{
  "$schema": "https://json-schema.org/draft/2020-12/schema",
  "$id": "https://lattice.dev/schemas/dashboard/1.0.0",
  "title": "Lattice Dashboard",
  "description": "Top-level schema for a Lattice dashboard document: a manifest plus a single root item instance forming a recursive tree.",
  "type": "object",
  "required": ["manifest", "root"],
  "additionalProperties": false,
  "properties": {
    "manifest": {
      "$ref": "#/$defs/manifest"
    },
    "root": {
      "$ref": "#/$defs/instance",
      "description": "The root item instance. Conventionally a container, but the container-only-children rule is enforced by the resolver (E1-S4), not the schema."
    },
    "variables": {
      "description": "Document-scope variable declarations. Visible to every node unless shadowed by a same-named declaration on a descendant container (E3-S1).",
      "type": "array",
      "items": {
        "$ref": "#/$defs/varDeclaration"
      }
    },
    "theme": {
      "description": "Optional document-scope DEFAULT THEME (E2-S2): the document's base presentation choices, drawn from the shared theme vocabulary. Its value is constrained to the theme schema's semantic tokens, so an out-of-vocabulary token (or value) is rejected by structural validation. The resolver attaches it verbatim to the resolved document output as the default layer; per-block theme overrides (E2-S3) are emitted side-by-side and are NOT merged here.",
      "$ref": "https://lattice.dev/schemas/theme/1.0.0"
    },
    "connections": {
      "description": "Optional document-scoped data connection instances. Each references a connection-type schema in schemas/connections/ via $ref; the resolver validates each connection's config against that type (E4-S1). Connections are declared and validated only, never dialed.",
      "type": "array",
      "items": {
        "$ref": "#/$defs/connection"
      }
    }
  },
  "documentScopes": {
    "description": "Document-scope CONFIGURABLE SURFACES (E4-S2): the per-scope, machine-readable list of the runtime-tunable fields of each reserved document scope (`$manifest`, `$variables`, `$connections`, `$theme`, `$root`). A configurator whose `target` is a reserved `$`-keyword (E4-S1) auto-generates a document-level editor form from the matching scope surface here, reusing the item form-generation path. Each entry uses the SAME descriptor shape as an item type's `configurable` keyword (field -> { type, label, constraints?, rendering? }); field names are validated by the resolver against the scope's real schema properties (the manifest's properties for `$manifest`, the theme vocabulary's tokens for `$theme`). The surface also DOUBLES as the guardrail enumerating the legal target paths a JSON Patch may touch within the scope. Generation only — the resolver applies no change from this declaration.",
    "$manifest": {
      "title": {
        "type": "string",
        "label": "Title",
        "rendering": "text-input",
        "constraints": {
          "description": "The dashboard's human-readable title."
        }
      },
      "description": {
        "type": "string",
        "label": "Description",
        "rendering": "textarea",
        "constraints": {
          "description": "An optional longer-form description of the dashboard."
        }
      }
    },
    "$theme": {
      "emphasis": {
        "type": "enum",
        "label": "Emphasis",
        "rendering": "select",
        "constraints": {
          "description": "How prominent the styled element appears.",
          "enum": ["none", "low", "high"]
        }
      },
      "spacing": {
        "type": "enum",
        "label": "Spacing",
        "rendering": "select",
        "constraints": {
          "description": "The relative amount of internal/outer breathing room.",
          "enum": ["compact", "cosy", "roomy"]
        }
      },
      "density": {
        "type": "enum",
        "label": "Density",
        "rendering": "select",
        "constraints": {
          "description": "How tightly repeated/listed content is packed.",
          "enum": ["comfortable", "compact"]
        }
      },
      "tone": {
        "type": "enum",
        "label": "Tone",
        "rendering": "select",
        "constraints": {
          "description": "The semantic colour intent, expressed by meaning.",
          "enum": ["neutral", "accent", "positive", "caution", "critical"]
        }
      },
      "radius": {
        "type": "enum",
        "label": "Corner Radius",
        "rendering": "select",
        "constraints": {
          "description": "How softened the corners of the styled surface are.",
          "enum": ["none", "subtle", "rounded"]
        }
      },
      "border": {
        "type": "enum",
        "label": "Border Weight",
        "rendering": "select",
        "constraints": {
          "description": "How present a separating edge is around the styled surface.",
          "enum": ["none", "hairline", "standard"]
        }
      }
    },
    "$variables": {},
    "$connections": {},
    "$root": {}
  },
  "$defs": {
    "varDeclaration": {
      "title": "Variable Declaration",
      "description": "A typed variable declaration { name, type, default?|expr?, options? }. Declarable at document scope and on container instances; resolution walks the tree with inner-shadows-outer semantics (E3-S1). A variable's value is either a literal default or a computed expr (E3-S3), never both.",
      "type": "object",
      "required": ["name", "type"],
      "additionalProperties": false,
      "properties": {
        "name": {
          "description": "Variable identifier, unique within its declaring scope.",
          "type": "string",
          "minLength": 1
        },
        "type": {
          "description": "Declared value type.",
          "type": "string",
          "enum": ["string", "number", "integer", "boolean", "enum", "array"]
        },
        "default": {
          "description": "Optional default value; validated against type by the resolver (E3-S1). Mutually exclusive with expr."
        },
        "expr": {
          "description": "Optional computed-variable expression (github.com/expr-lang/expr) evaluated against the in-scope variables; its result is coerced/validated to type by the resolver (E3-S3). Mutually exclusive with default.",
          "type": "string",
          "minLength": 1
        },
        "options": {
          "description": "Permitted values for enum-typed variables. Required for enum, forbidden otherwise; enforced by the resolver (E3-S1).",
          "type": "array",
          "items": {
            "type": "string"
          }
        }
      }
    },
    "connection": {
      "title": "Connection Instance",
      "description": "A document-scoped data connection instance. References a connection-type schema via $ref and carries opaque per-connection config validated against that type by the resolver (E4-S1). Secrets are referenced indirectly via secretRefs, never inlined.",
      "type": "object",
      "required": ["id", "$ref"],
      "additionalProperties": false,
      "properties": {
        "id": {
          "description": "Connection identifier, unique within the document. Items bind to a connection by this id.",
          "type": "string",
          "minLength": 1
        },
        "$ref": {
          "description": "URI of the connection-type schema this connection is an instance of (e.g. https://lattice.dev/schemas/connections/static/1.0.0). Validated against the catalog by the resolver.",
          "type": "string",
          "format": "uri",
          "minLength": 1
        },
        "config": {
          "description": "Per-connection configuration. Structure is defined by the referenced connection-type's schema; opaque at the dashboard level.",
          "type": "object"
        },
        "secretRefs": {
          "description": "Optional indirection from a config slot to a named secret resolved out-of-band. Maps a logical secret name to an opaque reference token; secret values are never inlined in the document.",
          "type": "object",
          "additionalProperties": {
            "type": "string",
            "minLength": 1
          }
        }
      }
    },
    "manifest": {
      "title": "Dashboard Manifest",
      "description": "Document-level metadata describing the dashboard.",
      "type": "object",
      "required": ["formatVersion", "id", "title"],
      "additionalProperties": false,
      "properties": {
        "formatVersion": {
          "description": "Semantic version of the dashboard document format this document targets.",
          "type": "string",
          "pattern": "^[0-9]+\\.[0-9]+\\.[0-9]+$"
        },
        "id": {
          "description": "Stable, machine-readable identifier for the dashboard.",
          "type": "string",
          "minLength": 1
        },
        "title": {
          "description": "Human-readable dashboard title.",
          "type": "string",
          "minLength": 1
        },
        "description": {
          "description": "Optional longer-form description of the dashboard.",
          "type": "string"
        },
        "author": {
          "description": "Optional author or owner of the dashboard.",
          "type": "string"
        }
      }
    },
    "instance": {
      "title": "Item Instance",
      "description": "A recursive instance node. References an item type via $ref, carries opaque per-instance config and placement, and may declare children. Whether children are permitted depends on the referenced item type (container-only); that rule is enforced by the resolver in E1-S4, not structurally here.",
      "type": "object",
      "required": ["$ref"],
      "additionalProperties": false,
      "properties": {
        "$ref": {
          "description": "URI of the item-type schema this instance is an instance of (e.g. https://lattice.dev/schemas/items/table/1.0.0). Validated against the catalog by the resolver.",
          "type": "string",
          "format": "uri",
          "minLength": 1
        },
        "id": {
          "description": "Optional instance-local identifier, unique within the document.",
          "type": "string",
          "minLength": 1
        },
        "config": {
          "description": "Per-instance configuration. Structure is defined by the referenced item type's schema; opaque at the dashboard level.",
          "type": "object"
        },
        "placement": {
          "description": "Optional layout placement hints interpreted by the parent container's grid. Minimal/stubbed here; E2-S1 formalizes track placement.",
          "type": "object"
        },
        "children": {
          "description": "Optional child instances. Structurally permitted on any instance; only valid when the referenced type is a container, enforced by the resolver in E1-S4.",
          "type": "array",
          "items": {
            "$ref": "#/$defs/instance"
          }
        },
        "variables": {
          "description": "Optional variable declarations scoped to this instance and its descendants. Meaningful on container instances; an inner declaration shadows a same-named outer one (E3-S1).",
          "type": "array",
          "items": {
            "$ref": "#/$defs/varDeclaration"
          }
        }
      }
    }
  }
}
